title,description,jobType,deadline,keywords,skills,jobLink,hiringTeam,workType,workEmail,allowEmailApplications,numberOfPositions,company,companyWebsite,companyLogo,companyEmail,locationName,formattedAddress,city,state,country,latitude,longitude,salaryMin,salaryMax,salaryCurrency,salaryPeriod
"Fancy yourself a production designer, eh?","Overview We are looking to hire a production-oriented Designer that has experience in branding, digital design, and advertising. You will work with our creative",FULLTIME,,design|creative|brand,branding,https://www.foxfuelcreative.com/careers/production-designer/,system-scraper,,michael@foxfuelcreative.com,true,,Foxfuelcreative,https://foxfuelcreative.com,,michael@foxfuelcreative.com,,,,,,,,,,,
Product & Design Teams,Asana is growing fast to achieve a big mission that drives us every day. Passionate and curious people like you will help us achieve it.,FULLTIME,,design,,https://asana.com/jobs/product,system-scraper,,u003eaccount@domain.com,true,,Asana,https://asana.com,,u003eaccount@domain.com,,,,,,,,,,,
Design Engineer,"Build better websites with a team obsessed with technical perfection. Shape the future of web development while pursuing pixel-perfect, high-performance solutions.",FULLTIME,,design|ui,,https://bejamas.com/careers/design-engineer-x3mbzomt96,system-scraper,,hr@bejamas.com,true,,Bejamas,https://bejamas.com,,hr@bejamas.com,,,,,,,,,,,
Content Marketing Manager,"<h1>Content Marketing Manager</h1><p>Remote - US</p><p><a href=""https://bitly.com/pages/about"">Bitly</a> is the world’s leading Connections Platform, empowering businesses to create memorable connections with their customers at every physical and digital touchpoint. From Fortune 500 companies to small businesses, millions of people around the world rely on Bitly for custom short links, QR Codes, and landing pages that are easy to create, share, and manage. With tools to track and optimize every interaction, we help businesses understand what drives the greatest impact.</p><p>As we continue to redefine how brands interact with customers, we're looking for passionate individuals eager to drive innovation and shape the future of engagement. Join us in turning every click, tap, and scan into a powerful catalyst for connections.</p><p>We know the best teams bring different backgrounds, perspectives, and lived experiences. If you're excited about a role and believe your skills and experiences align meaningfully with it, we encourage you to apply.</p><h2><strong>The Role</strong></h2><p>Bitly is looking for a Content Marketing Manager to own and evolve our content strategy and help shape how our brands educate, inform, and build trust with audiences across channels. As the way people discover, evaluate, and learn about products continues to change, credible, high-quality content plays a critical role in how Bitly shows up—from data storytelling and thought leadership to customer stories and product education.</p><p>In this role on the Brand &amp; Content team, you’ll ensure our content brings our narrative to life in ways that support both our brand and business goals. You’ll own our thought leadership content program end-to-end and develop narratives that help position Bitly as leaders in our industry. This role is ideal for a strong individual contributor who’s excited by the opportunity to create meaningful, high-impact content that helps shape how people understand and experience Bitly.</p><h2><strong>Key Responsibilities</strong></h2><ul><li>Own content marketing programs across Bitly and its related brand channels, from strategy and planning through creation, distribution, and performance</li><li>Stay on top of emerging trends in content, AI, and audience behavior, helping ensure Bitly’s content strategy looks ahead to a changing landscape</li><li>Lead emerging and opportunistic content initiatives (e.g., podcasts, editorial formats, new media types), testing and scaling new ways to reach and engage audiences over time</li><li>Exercise strong editorial judgment in prioritizing content ideas, formats, and opportunities based on business&nbsp; impact and audience needs</li><li>Leverage AI-powered tools and workflows to systematize and scale components of content creation, distribution, and analysis</li><li>Lead the creation of original data-driven reports and research to drive thought leadership, turning insights into narratives that build credibility</li><li>Lead Bitly’s YouTube content strategy in close partnership with Creative, Acquisition, and Product Marketing, ensuring video content supports full-funnel goals from awareness through education and adoption</li><li>Create customer stories and case studies in partnership with the Product Marketing team, bringing real-world use cases, outcomes, and value to life</li><li>Own content distribution programs that extend the lifecycle of core content by repurposing and adapting assets across channels and formats</li><li>Optimize content for discoverability across human and AI-driven surfaces, working closely with the Acquisition team to support SEO and GEO priorities</li><li>Partner with the Brand team, external leaders, customers, and industry voices to co-create authority-building content that earns citations, third-party references, and broader industry visibility</li><li>Support product launches and marketing campaigns with content that educates new and existing customers, ensuring alignment with messaging, timing, and go-to-market priorities</li><li>Support executive thought leadership through content development and ghostwriting, in partnership with the rest of the Brand &amp; Content team</li><li>Track and report on content performance and engagement, using insights to inform clear actions that improve effectiveness over time.</li></ul><h2><strong>Requirements</strong></h2><ul><li>4–6+ years of experience in content marketing, editorial, or storytelling roles for high-volume, product-led B2B, SaaS, or technology-driven products</li><li>Proven experience owning content programs from strategy and creation through distribution and performance measurement</li><li>Strong writing and editing skills, with the ability to adapt tone, voice, and format across content types, audiences, and channels</li><li>Experience creating a range of content, including thought leadership, data-driven reports, customer stories, and multimedia or video-adjacent content</li><li>Ability to work independently while collaborating effectively with cross-functional partners across the organization</li><li>Sound editorial judgment, strong attention to detail, and the ability to prioritize in a fast-moving environment</li><li>Creative, curious, and open to feedback, with an interest in how AI is shaping the future of content.</li></ul><h2><strong>What Success Looks Like</strong></h2><ul><li>Pillar content drives consistent, high-quality traffic and engagement</li><li>Distributed content generates meaningful traffic and citations across key channels</li><li>Video content improves discoverability, reflected in growing search-driven traffic</li><li>Thought leadership program expands reach and visibility across priority audiences</li><li>Content earns strong engagement and attention from industry voices and partners</li></ul><p><strong>US Employee Benefits -</strong><strong>Your benefits start on Day 1!</strong></p><p><strong>Health &amp; Wellbeing&nbsp;</strong></p><ul><li>Inclusive health, dental, and vision plans built to support diverse lifestyles.</li><li>Employer contribution to HSA plans.</li><li>Generous paid parental leave.</li><li>Enhanced support for reproductive health, family planning, and new parents.</li><li>Robust mental health support and Employee Assistance Program (EAP) with confidential counseling services.</li><li>Comprehensive well-being benefits, including a reimbursement program,</li><li>Flexible PTO policy.</li></ul><p><strong>Inclusion &amp; Belonging</strong></p><ul><li>Impactful connections and community building through our Employee Resource Groups</li><li>Company-sponsored events to connect Bitizens together.</li></ul><p><strong>Financial</strong>&nbsp;</p><ul><li>401k with up to 4% employer match, access to financial professionals to offer our employees the opportunity to plan for a strong financial future well beyond their working years.</li><li>Stock Options.</li><li>Life, Short-term Disability, and Long-term Disability options.</li><li>Flexible workspace support provided, including home office, cell phone, and WiFi service reimbursement.</li><li>Coworking reimbursement for eligible employees.</li><li>Voluntary Benefits: Pet Insurance, LegalShield, IDShield, Hospitalization, and Accident coverages.</li><li>Reimbursement for professional development.</li></ul><p><strong>Eligibility</strong></p><p>US applicants must be currently authorized to work in the United States on a full-time basis. Bitly does not sponsor or support any immigration processing.</p><p><strong>*** Must live in or be willing to relocate to one of the following states to be eligible for hire: Arizona, California, Colorado, Connecticut, Florida, Georgia, Illinois, Louisiana, Massachusetts, Michigan, Minnesota, New York, New Jersey,&nbsp; North Carolina, Pennsylvania, Texas, Vermont, Virginia, Washington ***</strong></p><p>If you are based in California, we encourage you to read this important information for California residents linked here. (<a href=""https://bitly.is/CPRACandidates"">https://bitly.is/CPRACandidates</a>)</p><p>As part of our hiring process, we conduct routine measures to verify the authenticity of candidate applications and credentials. These steps help us maintain a fair, secure, and high-quality recruitment experience for all applicants.</p><p><strong>Compensation</strong></p><p>The salary range for this role takes into account a wide range of factors considered in making compensation decisions including, but not limited to, skill sets, experience and training, licensure and certifications as well as other business and organizational needs.</p><p>Base Salary Range</p><p>$96,000 - $132,000 USD</p><p>Create a Job Alert</p><p>Interested in building your career at Bitly Inc.? Get future opportunities sent straight to your email.</p><a href=""https://my.greenhouse.io/users/sign_in?job_board=bitly&amp;source=job_alert_post"">Create alert</a>",FULLTIME,,creative|brand|content|ui|video|research,seo|and_experiences_align_meaningfully_with_it|we_encourage_you_to_apply,https://job-boards.eu.greenhouse.io/bitly/jobs/4780326101,system-scraper,REMOTE,,false,,Bitly,,,,,,,,,,,96000,132000,USD,ANNUAL
Staff Product Designer (UX/UI),"<h1>Staff Product Designer (UX/UI)</h1><h3>Job Description</h3><p>Black Airplane is a digital product agency dedicated to solving complex business problems through innovative technology and design. We focus on developing impactful products by combining technical expertise with a commitment to creative excellence.</p><p>We're looking for a world-class Staff Product Designer who can lead complex design initiatives while serving as a strategic design partner to both our team and our clients. This individual will drive substantial contributions to highly complex projects, mentor other designers, and champion the adoption of AI-enhanced design workflows. You'll shape design systems across multiple teams, participate in pre-sales efforts, and consistently deliver solutions that have measurable impact on both user experience and business outcomes.</p><p><strong>Who We're Looking For</strong></p><ul><li><strong>Design leader</strong> with 5-8 years of experience and a proven track record of shipping multiple large products and complex design systems</li><li><strong>Strategic contributor</strong> who provides strategic input on design decisions and shapes broad architecture across client projects</li><li><strong>Systems designer</strong> skilled at synthesizing complex business requirements, user research, and technical constraints into coherent design strategies</li><li><strong>AI advocate</strong> who champions AI tool adoption across teams and develops AI-enhanced workflows that multiply team efficiency</li><li><strong>Team multiplier</strong> who facilitates cross-team work and serves as a role model and mentor to all team members</li><li><strong>Business contributor</strong> capable of accurate project estimation and active participation in pre-sales efforts to support client acquisition</li><li><strong>Quality driver</strong> known for consistently delivering large systems involving multiple teams on time and with exceptional quality</li></ul><p>Location</p><p>Remote friendly</p><p>Job Type</p><p>full-time</p><p>Salary Range</p><p>$<!-- -->108100<!-- --> - $<!-- -->131486</p><p>Benefits</p><ul><li>Health Insurance</li><li>401K (with matching)</li><li>Macbook Pro</li><li>Learning Opportunities</li><li>Generous Time Off</li><li>Dental</li><li>Vision</li><li>Life Insurance</li><li>and more...</li></ul><p><a href=""https://black-airplane.breezy.hr/p/8f03edad2d6a-staff-product-designer-ui-ux/apply""></a></p><p><a href=""https://black-airplane.breezy.hr/p/8f03edad2d6a-staff-product-designer-ui-ux/apply"">apply here</a></p><p></p><h5>Responsibilities</h5><ul><li><strong>Lead design initiatives</strong> for highly complex client projects, anticipating product-level design issues and making strategic decisions to prevent them while providing strategic input that impacts long-term success</li><li><strong>Champion AI tool adoption</strong> across the design team, developing AI-enhanced workflows, and training others on advanced AI prototyping techniques to multiply team effectiveness</li><li><strong>Design complex systems</strong> involving multiple teams and stakeholders, mastering the full input-process-output (systems thinking) framework from business requirements to comprehensive developer handoff packages</li><li><strong>Participate in pre-sales efforts</strong> to assess design feasibility and requirements, providing reliable project estimates that inform client proposals and resource planning strategies</li><li><strong>Facilitate cross-team collaboration</strong> by breaking down complex problems into solutions, knowns, and unknowns swiftly while serving as a role model for design excellence across all project teams</li><li><strong>Drive process leadership</strong> by leading internal conversations about major design process directions, driving wide-team consensus and mentoring junior and senior designers to foster continuous learning</li></ul><h5>Qualifications</h5><ul><li>Educational foundation with Bachelor's Degree in Design, Human-Computer Interaction, or equivalent industry experience demonstrating comprehensive design expertise</li><li>Extensive experience of 5-8 years in product design with demonstrated expertise &amp; a supporting portfolio in UI and UX design principles across web and mobile platforms with multiple successful product launches</li><li>Advanced tool proficiency with expert-level Figma skills including design systems, design tokens, and engineer annotations, plus ability to anticipate broad technical changes</li><li>AI integration expertise with proven experience championing AI tool adoption, developing AI-enhanced workflows using ChatGPT, Claude, Lovable, v0, Figma Make, and/or others for work and team efficiency</li><li>Systems thinking capabilities with ability to design complex systems, make strategic trade-offs supporting business initiatives, and deliver measurable client satisfaction outcomes</li><li>Leadership and estimation skills including accurate project estimation for complex projects, pre-sales assessment experience, exceptional communication abilities, and proven mentoring experience that enhances team performance</li></ul><p><strong>This is a full-time, remote position (US only).</strong></p><p>Black Airplane is a fully remote friendly environment. Work location is flexible if approved by Black Airplane, except that the position may not be performed remotely from AK, CA, HI, MA, NY, OR, PA, WA, or outside of the United States.</p><p><a href=""https://black-airplane.breezy.hr/p/8f03edad2d6a-staff-product-designer-ui-ux/apply""></a></p><p><a href=""https://black-airplane.breezy.hr/p/8f03edad2d6a-staff-product-designer-ui-ux/apply"">apply here</a></p><p></p><p>Location</p><p>Remote friendly</p><p>Job Type</p><p>full-time</p><p>Salary Range</p><p>$<!-- -->108100<!-- --> - $<!-- -->131486</p><p>Benefits</p><ul><li>Health Insurance</li><li>401K (with matching)</li><li>Macbook Pro</li><li>Learning Opportunities</li><li>Generous Time Off</li><li>Dental</li><li>Vision</li><li>Life Insurance</li><li>and more...</li></ul><p><a href=""https://black-airplane.breezy.hr/p/8f03edad2d6a-staff-product-designer-ui-ux/apply""></a></p><p><a href=""https://black-airplane.breezy.hr/p/8f03edad2d6a-staff-product-designer-ui-ux/apply"">apply here</a></p><p></p><p>BENEFITS</p><h3>First-class perks for a world-class team</h3><p>Company Computer</p><p>From day one you'll have a lightning-fast company-provided computer to ensure that you have the necessary tools and resources to hit the ground running.</p><p>Learning Opportunities</p><p>We value learning opportunities for professional growth and development, to enhance your skills and expand your knowledge base.</p><p>Work From Anywhere</p><p>Not located in Woodstock, Georgia? Not a problem! Black Airplane has employees all over the US and creates a remote positive culture.</p><p>Time Off</p><p>We value a positive work-life balance and offer competitive PTO benefits. This ensures that you have the opportunity to recharge, relax, and spend time with loved ones.</p><p>Healthcare</p><p>Access to healthcare benefits, such as medical, dental, and vision insurance, are crucial for maintaining your well-being and peace of mind. We provide comprehensive healthcare coverage for our employees.</p>",FULLTIME,,design|creative|ux|ui|product design|research,figma|prototyping|design_systems|ux_research|design_tokens|human-computer_interaction|engineer_annotations|pre-sales_assessment_experience|exceptional_communication_abilities|proven_mentoring_experienc|and_expand_your_knowledge_base,https://blackairplane.com/careers/staff-product-designer,system-scraper,REMOTE,,false,,Blackairplane,https://blackairplane.com,,,,,,,,,,108100,131486,USD,ANNUAL
UI/UX Designer Jr.,"<h1> UI/UX Designer Jr. </h1><p> Remote </p><h2> About </h2><p><strong>Buzzvel</strong> is a company created by programmers over six years that works from Lisbon to the World with digital solutions for several customers in various areas such as <strong>Education, Retail, Telecommunications, Finance, Software &amp; High Tech, and Blockchain.</strong></p><h3><strong>Responsibilities:</strong></h3><ul><li><p>Create user-centered designs by understanding business requirements, user needs, and technical constraints.</p></li><li><p>Design and prototype user interfaces and experiences for web and mobile applications.</p></li><li><p>Develop design specifications and guidelines to ensure consistency across our products and services;</p></li><li><p>Collaborate with cross-functional teams, including product managers, engineers, and other designers;</p></li><li><p>Conduct user research and testing to validate design concepts and iterate on designs based on user feedback;</p></li><li><p>Stay up-to-date with design trends, tools, and technologies.</p></li></ul><h3> Things we are looking for </h3><ul><li><p>Bachelor's degree in design or a related field;</p></li><li><p>Strong portfolio showcasing user-centered design solutions</p></li><li><p>Proficiency in design tools such as Figma, Sketch, or Adobe Creative Suite;</p></li><li><p>Experience with design systems and style guides</p></li><li><p>Proficiency in prototyping, visual design, and wireframing tools;</p></li><li><p>Excellent communication and collaboration skills;</p></li><li><p>Problem-solving, creativity, organization, and teamwork;</p></li><li><p>Ability to work independently and manage multiple projects simultaneously;</p></li><li><p>Tech savvy &amp; internet lover;</p></li><li><p>Fluency in english and portuguese (mandatory);</p></li></ul>",FULLTIME,,design|creative|visual|ux|ui|research,figma|sketch|adobe_creative_suite|prototyping|wireframing|design_systems|ux_research|visual_design,https://buzzvel.com/careers/ui-ux-designer,system-scraper,REMOTE,,false,,Buzzvel,https://buzzvel.com,,,,,,,,,,,,,
